,Unnamed: 0,item,plural,classification,frequency_rank,recipient_id,DOsentence,PDsentence,DO_score,PD_score,diff
153,154,53,FALSE,non-alternating,53,shortIndefinite,Bob articulated a man a rule.,Bob articulated a rule to a man.,-10.03677217,-10.3227506,0.285978427
154,155,55,FALSE,non-alternating,55,longIndefinite,Linda groaned a man wearing a hat a reply.,Linda groaned a reply to a man wearing a hat.,-9.88639194,-9.780788253,-0.105603687
155,156,55,FALSE,non-alternating,55,shortIndefinite,Alice groaned a man a reply.,Alice groaned a reply to a man.,-9.657671205,-10.72800341,1.070332209
156,157,57,FALSE,non-alternating,57,longIndefinite,Michael roared a woman who was from work an order.,Michael roared an order to a woman who was from work.,-10.23890347,-10.42951538,0.19061191
157,158,57,FALSE,non-alternating,57,shortIndefinite,Mary roared a woman an order.,Mary roared an order to a woman.,-10.42284019,-10.27254352,-0.150296667
158,159,59,FALSE,non-alternating,59,longIndefinite,Maria recounted a woman from work some information.,Maria recounted some information to a woman from work.,-9.636226345,-10.55870361,0.922477269
159,160,59,FALSE,non-alternating,59,shortIndefinite,Michael recounted a man some information.,Michael recounted some information to a man.,-10.49202768,-10.87407696,0.382049272
160,161,61,FALSE,non-alternating,61,longIndefinite,Mary denounced a man from work a law.,Mary denounced a law to a man from work.,-11.39910457,-8.899825734,-2.499278832
161,162,61,FALSE,non-alternating,61,shortIndefinite,Mary denounced a man a law.,Mary denounced a law to a man.,-11.1632258,-8.716389596,-2.446836204
162,163,63,FALSE,non-alternating,63,longIndefinite,Alice murmured a woman from work a comment.,Alice murmured a comment to a woman from work.,-10.05660535,-9.984692089,-0.071913264
163,164,63,FALSE,non-alternating,63,shortIndefinite,Mary murmured a woman a comment.,Mary murmured a comment to a woman.,-10.90672028,-10.90134976,-0.005370527
164,165,65,FALSE,non-alternating,65,longIndefinite,Michael moaned a man wearing a hat a plea.,Michael moaned a plea to a man wearing a hat.,-8.451138803,-9.011194141,0.560055337
165,166,65,FALSE,non-alternating,65,shortIndefinite,Michael moaned a man a plea.,Michael moaned a plea to a man.,-8.723283364,-9.309455877,0.586172513
166,167,67,TRUE,non-alternating,67,longIndefinite,Alice dispatched a team from work some meals.,Alice dispatched some meals to a team from work.,-8.875782515,-8.663579641,-0.212202874
167,168,67,TRUE,non-alternating,67,shortIndefinite,Linda dispatched a team some meals.,Linda dispatched some meals to a team.,-8.987481735,-9.325321615,0.337839879
168,169,69,FALSE,non-alternating,69,longIndefinite,Maria mumbled a man from work some news.,Maria mumbled some news to a man from work.,-8.221007036,-9.829872806,1.60886577
169,170,69,FALSE,non-alternating,69,shortIndefinite,John mumbled a man some news.,John mumbled some news to a man.,-8.261760683,-8.405056517,0.143295834
170,171,71,TRUE,non-alternating,71,longIndefinite,Mary furnished a team from work some forms.,Mary furnished some forms to a team from work.,-9.326076477,-8.895181683,-0.430894794
171,172,71,TRUE,non-alternating,71,shortIndefinite,John furnished a team some forms.,John furnished some forms to a team.,-7.957184442,-8.000703992,0.04351955
172,173,73,FALSE,non-alternating,73,longIndefinite,Alice howled a woman from work a complaint.,Alice howled a complaint to a woman from work.,-8.350605149,-8.722898036,0.372292887
173,174,73,FALSE,non-alternating,73,shortIndefinite,Michael howled a man a complaint.,Michael howled a complaint to a man.,-9.565852085,-10.29580661,0.729954527
174,175,75,FALSE,non-alternating,75,longIndefinite,Maria grumbled a man who was from work a name.,Maria grumbled a name to a man who was from work.,-8.526088499,-9.723249918,1.197161419
175,176,75,FALSE,non-alternating,75,shortIndefinite,Juan grumbled a man a name.,Juan grumbled a name to a man.,-9.476786027,-9.914742729,0.437956702
176,177,77,FALSE,non-alternating,77,longIndefinite,Juan narrated a woman who was from work a show.,Juan narrated a show to a woman who was from work.,-8.431300706,-9.257539786,0.826239081
177,178,77,FALSE,non-alternating,77,shortIndefinite,Maria narrated a man a show.,Maria narrated a show to a man.,-10.04887624,-10.17587608,0.126999842
178,179,79,FALSE,non-alternating,79,longIndefinite,Alice grunted a man who was from work a name.,Alice grunted a name to a man who was from work.,-8.890813167,-10.10638397,1.215570807
179,180,79,FALSE,non-alternating,79,shortIndefinite,Michael grunted a woman a name.,Michael grunted a name to a woman.,-8.334066822,-10.0214395,1.687372681
180,181,81,FALSE,non-alternating,81,longIndefinite,Bob hollered a man from work some news.,Bob hollered some news to a man from work.,-9.351383039,-9.492538296,0.141155257
181,182,81,FALSE,non-alternating,81,shortIndefinite,Alice hollered a woman some news.,Alice hollered some news to a woman.,-8.811439423,-9.345327679,0.533888256
182,183,83,FALSE,non-alternating,83,longIndefinite,Bob squealed a woman from work an answer.,Bob squealed an answer to a woman from work.,-10.21129058,-9.93970572,-0.271584864
183,184,83,FALSE,non-alternating,83,shortIndefinite,Mary squealed a woman an answer.,Mary squealed an answer to a woman.,-10.57931284,-10.08193395,-0.497378886
184,185,85,FALSE,non-alternating,85,longIndefinite,Linda delegated a woman who was from work a task.,Linda delegated a task to a woman who was from work.,-10.51995587,-9.402429747,-1.117526127
185,186,85,FALSE,non-alternating,85,shortIndefinite,Alice delegated a man a task.,Alice delegated a task to a man.,-10.55673964,-8.977303523,-1.579436114
186,187,87,FALSE,non-alternating,87,longIndefinite,Mary screeched a woman wearing a hat a thought.,Mary screeched a thought to a woman wearing a hat.,-9.982131809,-10.16422387,0.182092061
187,188,87,FALSE,non-alternating,87,shortIndefinite,Maria screeched a man a thought.,Maria screeched a thought to a man.,-10.46860377,-10.70630805,0.237704285
188,189,89,FALSE,non-alternating,89,longIndefinite,Juan bellowed a man who was from work an order.,Juan bellowed an order to a man who was from work.,-9.31629261,-9.076789473,-0.239503137
189,190,89,FALSE,non-alternating,89,shortIndefinite,Mary bellowed a man an order.,Mary bellowed an order to a man.,-8.234116644,-9.597704226,1.363587583
190,191,91,FALSE,non-alternating,91,longIndefinite,John cackled a woman wearing a hat some noises.,John cackled some noises to a woman wearing a hat.,-8.314546068,-8.473257647,0.158711578
191,192,91,FALSE,non-alternating,91,shortIndefinite,John cackled a man some noises.,John cackled some noises to a man.,-8.255115335,-8.459821656,0.20470632
192,193,93,FALSE,non-alternating,93,longIndefinite,Mary croaked a man wearing a hat a request.,Mary croaked a request to a man wearing a hat.,-9.616173248,-9.682792257,0.066619009
193,194,93,FALSE,non-alternating,93,shortIndefinite,Bob croaked a woman a request.,Bob croaked a request to a woman.,-10.21417259,-10.19004416,-0.024128428
194,195,95,FALSE,non-alternating,95,longIndefinite,Bob stammered a woman wearing a hat a thought.,Bob stammered a thought to a woman wearing a hat.,-9.231523724,-9.485273171,0.253749447
195,196,95,FALSE,non-alternating,95,shortIndefinite,John stammered a woman a thought.,John stammered a thought to a woman.,-8.415805468,-8.498893964,0.083088496
196,197,97,FALSE,non-alternating,97,longIndefinite,Linda remitted a woman who was from work a percentage.,Linda remitted a percentage to a woman who was from work.,-10.40808133,-10.41881076,0.010729426
197,198,97,FALSE,non-alternating,97,shortIndefinite,Maria remitted a man a percentage.,Maria remitted a percentage to a man.,-9.287170033,-9.508829147,0.221659114
198,199,99,FALSE,non-alternating,99,longIndefinite,John warbled a man from work a greeting.,John warbled a greeting to a man from work.,-8.604407805,-8.745821592,0.141413787
199,200,99,FALSE,non-alternating,99,shortIndefinite,John warbled a woman a greeting.,John warbled a greeting to a woman.,-8.460794239,-8.576109455,0.115315215
