,Unnamed: 0,item,plural,classification,frequency_rank,recipient_id,DOsentence,PDsentence,DO_score,PD_score,diff
139,140,39,False,non-alternating,39,shortIndefinite,Michael snapped a man a comment.,Michael snapped a comment to a man.,-6.8409857749938965,-5.454930305480957,1.3860554695129395
140,141,41,True,non-alternating,41,longIndefinite,John distributed a team from work some books.,John distributed some books to a team from work.,-7.192380428314209,-5.533998966217041,1.658381462097168
141,142,41,True,non-alternating,41,shortIndefinite,Linda distributed a team some books.,Linda distributed some books to a team.,-7.47108793258667,-5.953421115875244,1.5176668167114258
142,143,43,True,non-alternating,43,longIndefinite,Mary donated a team from work a painting.,Mary donated a painting to a team from work.,-7.5492095947265625,-5.68815803527832,1.8610515594482422
143,144,43,True,non-alternating,43,shortIndefinite,Bob donated a team a painting.,Bob donated a painting to a team.,-6.665790557861328,-5.327517986297607,1.3382725715637207
144,145,45,False,non-alternating,45,longIndefinite,Mary administered a woman who was wearing a hat an antidote.,Mary administered an antidote to a woman who was wearing a hat.,-5.696773052215576,-3.8538472652435303,1.842925786972046
145,146,45,False,non-alternating,45,shortIndefinite,Bob administered a woman an antidote.,Bob administered an antidote to a woman.,-7.208896636962891,-5.080837726593018,2.128058910369873
146,147,47,False,non-alternating,47,longIndefinite,Juan conveyed a man from work a thought.,Juan conveyed a thought to a man from work.,-6.990454196929932,-5.670663833618164,1.3197903633117676
147,148,47,False,non-alternating,47,shortIndefinite,Alice conveyed a man a thought.,Alice conveyed a thought to a man.,-5.576573848724365,-4.41513204574585,1.1614418029785156
148,149,49,False,non-alternating,49,longIndefinite,Juan blabbed a man who was wearing a hat some information.,Juan blabbed some information to a man who was wearing a hat.,-5.380333423614502,-4.564321994781494,0.8160114288330078
149,150,49,False,non-alternating,49,shortIndefinite,Michael blabbed a woman some information.,Michael blabbed some information to a woman.,-6.136029243469238,-5.220226287841797,0.9158029556274414
150,151,51,False,non-alternating,51,longIndefinite,Maria surrendered a woman wearing a hat some guns.,Maria surrendered some guns to a woman wearing a hat.,-6.896706581115723,-5.071038246154785,1.8256683349609375
151,152,51,False,non-alternating,51,shortIndefinite,John surrendered a woman some guns.,John surrendered some guns to a woman.,-8.164376258850098,-6.080506801605225,2.083869457244873
152,153,53,False,non-alternating,53,longIndefinite,Bob articulated a woman from work a rule.,Bob articulated a rule to a woman from work.,-7.386818885803223,-5.831110954284668,1.5557079315185547
153,154,53,False,non-alternating,53,shortIndefinite,Bob articulated a man a rule.,Bob articulated a rule to a man.,-7.1773858070373535,-5.914403438568115,1.2629823684692383
154,155,55,False,non-alternating,55,longIndefinite,Linda groaned a man wearing a hat a reply.,Linda groaned a reply to a man wearing a hat.,-6.357512950897217,-5.218621730804443,1.1388912200927734
155,156,55,False,non-alternating,55,shortIndefinite,Alice groaned a man a reply.,Alice groaned a reply to a man.,-6.347667694091797,-5.377658843994141,0.9700088500976562
156,157,57,False,non-alternating,57,longIndefinite,Michael roared a woman who was from work an order.,Michael roared an order to a woman who was from work.,-7.2112226486206055,-6.001052379608154,1.2101702690124512
157,158,57,False,non-alternating,57,shortIndefinite,Mary roared a woman an order.,Mary roared an order to a woman.,-7.9396843910217285,-6.644477844238281,1.2952065467834473
158,159,59,False,non-alternating,59,longIndefinite,Maria recounted a woman from work some information.,Maria recounted some information to a woman from work.,-7.193630218505859,-5.828587055206299,1.3650431632995605
159,160,59,False,non-alternating,59,shortIndefinite,Michael recounted a man some information.,Michael recounted some information to a man.,-7.726238250732422,-6.3694586753845215,1.3567795753479004
160,161,61,False,non-alternating,61,longIndefinite,Mary denounced a man from work a law.,Mary denounced a law to a man from work.,-6.487133026123047,-6.010339736938477,0.4767932891845703
161,162,61,False,non-alternating,61,shortIndefinite,Mary denounced a man a law.,Mary denounced a law to a man.,-6.874627590179443,-5.748128414154053,1.1264991760253906
162,163,63,False,non-alternating,63,longIndefinite,Alice murmured a woman from work a comment.,Alice murmured a comment to a woman from work.,-5.870367050170898,-4.894428253173828,0.9759387969970703
163,164,63,False,non-alternating,63,shortIndefinite,Mary murmured a woman a comment.,Mary murmured a comment to a woman.,-6.097208499908447,-5.16917085647583,0.9280376434326172
164,165,65,False,non-alternating,65,longIndefinite,Michael moaned a man wearing a hat a plea.,Michael moaned a plea to a man wearing a hat.,-6.135807991027832,-4.988960266113281,1.1468477249145508
165,166,65,False,non-alternating,65,shortIndefinite,Michael moaned a man a plea.,Michael moaned a plea to a man.,-6.907505989074707,-6.054339408874512,0.8531665802001953
166,167,67,True,non-alternating,67,longIndefinite,Alice dispatched a team from work some meals.,Alice dispatched some meals to a team from work.,-7.150898456573486,-6.5585479736328125,0.5923504829406738
167,168,67,True,non-alternating,67,shortIndefinite,Linda dispatched a team some meals.,Linda dispatched some meals to a team.,-7.986263751983643,-6.9092888832092285,1.076974868774414
168,169,69,False,non-alternating,69,longIndefinite,Maria mumbled a man from work some news.,Maria mumbled some news to a man from work.,-6.782068252563477,-6.198651313781738,0.5834169387817383
169,170,69,False,non-alternating,69,shortIndefinite,John mumbled a man some news.,John mumbled some news to a man.,-6.543831825256348,-5.773684024810791,0.7701478004455566
170,171,71,True,non-alternating,71,longIndefinite,Mary furnished a team from work some forms.,Mary furnished some forms to a team from work.,-7.8422722816467285,-6.389237403869629,1.4530348777770996
171,172,71,True,non-alternating,71,shortIndefinite,John furnished a team some forms.,John furnished some forms to a team.,-8.027783393859863,-6.539307594299316,1.4884757995605469
172,173,73,False,non-alternating,73,longIndefinite,Alice howled a woman from work a complaint.,Alice howled a complaint to a woman from work.,-6.0156450271606445,-5.331736087799072,0.6839089393615723
173,174,73,False,non-alternating,73,shortIndefinite,Michael howled a man a complaint.,Michael howled a complaint to a man.,-5.978733539581299,-5.617825031280518,0.36090850830078125
174,175,75,False,non-alternating,75,longIndefinite,Maria grumbled a man who was from work a name.,Maria grumbled a name to a man who was from work.,-6.1067214012146,-5.029107093811035,1.0776143074035645
175,176,75,False,non-alternating,75,shortIndefinite,Juan grumbled a man a name.,Juan grumbled a name to a man.,-6.674782752990723,-5.543011665344238,1.1317710876464844
176,177,77,False,non-alternating,77,longIndefinite,Juan narrated a woman who was from work a show.,Juan narrated a show to a woman who was from work.,-7.059072494506836,-6.209300994873047,0.8497714996337891
177,178,77,False,non-alternating,77,shortIndefinite,Maria narrated a man a show.,Maria narrated a show to a man.,-7.900405406951904,-6.616137981414795,1.2842674255371094
178,179,79,False,non-alternating,79,longIndefinite,Alice grunted a man who was from work a name.,Alice grunted a name to a man who was from work.,-6.482229232788086,-5.281924247741699,1.2003049850463867
179,180,79,False,non-alternating,79,shortIndefinite,Michael grunted a woman a name.,Michael grunted a name to a woman.,-7.533413887023926,-6.273196697235107,1.2602171897888184
180,181,81,False,non-alternating,81,longIndefinite,Bob hollered a man from work some news.,Bob hollered some news to a man from work.,-5.479582786560059,-4.828357219696045,0.6512255668640137
181,182,81,False,non-alternating,81,shortIndefinite,Alice hollered a woman some news.,Alice hollered some news to a woman.,-5.560718059539795,-4.767728805541992,0.7929892539978027
182,183,83,False,non-alternating,83,longIndefinite,Bob squealed a woman from work an answer.,Bob squealed an answer to a woman from work.,-5.634478569030762,-4.754270553588867,0.8802080154418945
183,184,83,False,non-alternating,83,shortIndefinite,Mary squealed a woman an answer.,Mary squealed an answer to a woman.,-6.103448867797852,-5.303888320922852,0.799560546875
184,185,85,False,non-alternating,85,longIndefinite,Linda delegated a woman who was from work a task.,Linda delegated a task to a woman who was from work.,-7.279930591583252,-5.449916839599609,1.8300137519836426
185,186,85,False,non-alternating,85,shortIndefinite,Alice delegated a man a task.,Alice delegated a task to a man.,-6.651875019073486,-4.819868564605713,1.8320064544677734
186,187,87,False,non-alternating,87,longIndefinite,Mary screeched a woman wearing a hat a thought.,Mary screeched a thought to a woman wearing a hat.,-6.24783992767334,-4.801507949829102,1.4463319778442383
187,188,87,False,non-alternating,87,shortIndefinite,Maria screeched a man a thought.,Maria screeched a thought to a man.,-6.388726234436035,-5.3486223220825195,1.0401039123535156
188,189,89,False,non-alternating,89,longIndefinite,Juan bellowed a man who was from work an order.,Juan bellowed an order to a man who was from work.,-6.90866231918335,-5.9384307861328125,0.9702315330505371
189,190,89,False,non-alternating,89,shortIndefinite,Mary bellowed a man an order.,Mary bellowed an order to a man.,-6.457993984222412,-6.094346046447754,0.3636479377746582
190,191,91,False,non-alternating,91,longIndefinite,John cackled a woman wearing a hat some noises.,John cackled some noises to a woman wearing a hat.,-6.080166816711426,-5.088294506072998,0.9918723106384277
191,192,91,False,non-alternating,91,shortIndefinite,John cackled a man some noises.,John cackled some noises to a man.,-6.494274139404297,-5.720618724822998,0.7736554145812988
192,193,93,False,non-alternating,93,longIndefinite,Mary croaked a man wearing a hat a request.,Mary croaked a request to a man wearing a hat.,-6.221919536590576,-5.531407356262207,0.6905121803283691
193,194,93,False,non-alternating,93,shortIndefinite,Bob croaked a woman a request.,Bob croaked a request to a woman.,-6.962777614593506,-5.873477935791016,1.0892996788024902
194,195,95,False,non-alternating,95,longIndefinite,Bob stammered a woman wearing a hat a thought.,Bob stammered a thought to a woman wearing a hat.,-5.198666095733643,-4.177433967590332,1.0212321281433105
195,196,95,False,non-alternating,95,shortIndefinite,John stammered a woman a thought.,John stammered a thought to a woman.,-5.690940856933594,-4.602182388305664,1.0887584686279297
196,197,97,False,non-alternating,97,longIndefinite,Linda remitted a woman who was from work a percentage.,Linda remitted a percentage to a woman who was from work.,-7.14134407043457,-5.934219837188721,1.2071242332458496
197,198,97,False,non-alternating,97,shortIndefinite,Maria remitted a man a percentage.,Maria remitted a percentage to a man.,-7.80243444442749,-6.8123297691345215,0.9901046752929688
198,199,99,False,non-alternating,99,longIndefinite,John warbled a man from work a greeting.,John warbled a greeting to a man from work.,-7.213498592376709,-5.9574198722839355,1.2560787200927734
199,200,99,False,non-alternating,99,shortIndefinite,John warbled a woman a greeting.,John warbled a greeting to a woman.,-7.342083930969238,-5.9247517585754395,1.4173321723937988
